<?xml version="1.0" encoding="UTF-8"?>
<xs:schema xmlns:xs="http://www.w3.org/2001/XMLSchema">

  <xs:element name="students">
    <xs:complexType>
      <xs:sequence>
        <xs:element name="student" maxOccurs="unbounded">
          <xs:complexType>
            <xs:sequence>
              <xs:element name="name" type="xs:string"/>
              <xs:element name="rollNumber" type="xs:integer"/>
              <xs:element name="age">
                <xs:simpleType>
                  <xs:restriction base="xs:integer">
                    <xs:minInclusive value="18"/>
                    <xs:maxInclusive value="30"/>
                  </xs:restriction>
                </xs:simpleType>
              </xs:element>
              <xs:element name="email">
                <xs:simpleType>
                  <xs:restriction base="xs:string">
                    <xs:pattern value="[a-zA-Z0-9._%+-]+@[a-zA-Z0-9.-]+\.[a-zA-Z]{2,4}"/>
                  </xs:restriction>
                </xs:simpleType>
              </xs:element>
            </xs:sequence>
          </xs:complexType>
        </xs:element>
      </xs:sequence>
    </xs:complexType>
  </xs:element>

</xs:schema>
